Title,Year,Medium,Width,Height,Depth,CreditLine,Classification,Department,YearAcquired,CuratorApproved,ObjectID
Untitled,(196,Watercolor on paper,29.8,21,null,The Judith Rothschild Foundation Contemporary Drawings Collection Gift,Drawing,Drawings,2005,Y,96957
Untitled,(196,Watercolor on paper,29.8,21,null,The Judith Rothschild Foundation Contemporary Drawings Collection Gift,Drawing,Drawings,2005,Y,96958
Untitled,(196,Watercolor on paper,29.8,21,null,The Judith Rothschild Foundation Contemporary Drawings Collection Gift,Drawing,Drawings,2005,Y,96959
Untitled,(196,Watercolor on paper,29.8,21,null,The Judith Rothschild Foundation Contemporary Drawings Collection Gift,Drawing,Drawings,2005,Y,96960
Untitled (Selbstportrait),(198,Watercolor on paper,29.8,21,null,The Judith Rothschild Foundation Contemporary Drawings Collection Gift,Drawing,Drawings,2005,Y,96970
Untitled (Kopf),(198,Watercolor on paper,29.8,21,null,The Judith Rothschild Foundation Contemporary Drawings Collection Gift,Drawing,Drawings,2005,Y,96971
Little Masturbator # 16,(200,Ballpoint pen on paper in box,28.6,22.2,null,The Judith Rothschild Foundation Contemporary Drawings Collection Gift,Drawing,Drawings,2005,Y,97072
Untitled (from the series Tree Wind Paintings),(198,Felt-tip pen on printed paper,55.9,76.2,null,The Judith Rothschild Foundation Contemporary Drawings Collection Gift,Drawing,Drawings,2005,Y,97689
Arbeitsstudie im Aktionismusgeschmack,(197,Pencil |  colored pencil |  and pressure-sensitive tape on printed paper,21,29.8,null,The Judith Rothschild Foundation Contemporary Drawings Collection Gift,Drawing,Drawings,2005,Y,97719
Werkblatt im Aktionismusgeschmack,(197,Pencil |  colored pencil |  and cut-and-pasted printed paper on printed paper,21,29.8,null,The Judith Rothschild Foundation Contemporary Drawings Collection Gift,Drawing,Drawings,2005,Y,97720
Untitled (Cafes – Intimate Grouping),(198,Cut-and-taped printed paper on three pieces of colored paper,28,21.6,null,The Judith Rothschild Foundation Contemporary Drawings Collection Gift,Drawing,Drawings,2005,Y,97772
Untitled (study for The Human Voice),(199,Oil |  synthetic polymer paint |  silkscreened and lithographed ink |  and modeling paste on paperboard |  all in mat,52.1,88.9,null,The Judith Rothschild Foundation Contemporary Drawings Collection Gift,Drawing,Drawings,2005,N,97780
Untitled (study for Remembrance of Things Past/Vintage Paperbacks),(200,Oil |  lithographed ink |  and modeling paste on seven pieces of paperboard,20.3,13.3,null,The Judith Rothschild Foundation Contemporary Drawings Collection Gift,Drawing,Drawings,2005,N,97781
Cryptonymous Infusion,(200,Ink and colored ink on paper,76.2,94,null,The Judith Rothschild Foundation Contemporary Drawings Collection Gift,Drawing,Drawings,2005,Y,97807
The Centaur,(189,Pastel with graphite on blue paper altered to a blue-gray tone |  mounted on board,72.4,49.5,null,Gift of Dian Woodner,Drawing,Drawings,2005,Y,98518
The Sky's the Limit,(198,Etching with chine collé and gouache additions,90.5,10,null,Gift of the artist,Print,Prints & Illustrated Books,2005,Y,98537
The Upward Journey,(198,Etching,23,10,null,Gift of the artist,Print,Prints & Illustrated Books,2005,Y,98538
Strange Fellows |  second version,(198,Etching on five plates,null,null,null,Gift of the artist,Print,Prints & Illustrated Books,2005,Y,98540
Strange Fellows |  second version,(198,Etching on five plates with watercolor additions,null,null,null,Gift of the artist,Print,Prints & Illustrated Books,2005,Y,98541
Storyboards,(198,Silkscreen on paper,60,40,null,Lily Auchincloss Fund,Print,Prints & Illustrated Books,2005,N,98894
Storyboards,(198,Silkscreen on paper,60,40,null,Lily Auchincloss Fund,Print,Prints & Illustrated Books,2005,N,98895
Storyboards,(198,Silkscreen on paper,60,40,null,Lily Auchincloss Fund,Print,Prints & Illustrated Books,2005,N,98896
Storyboards,(198,Silkscreen on paper,60,40,null,Lily Auchincloss Fund,Print,Prints & Illustrated Books,2005,N,98897
Storyboards,(198,Silkscreen on paper,60,40,null,Lily Auchincloss Fund,Print,Prints & Illustrated Books,2005,N,98898
Storyboards,(198,Silkscreen on paper,60,40,null,Lily Auchincloss Fund,Print,Prints & Illustrated Books,2005,N,98899
Storyboards,(198,Silkscreen on paper,60,40,null,Lily Auchincloss Fund,Print,Prints & Illustrated Books,2005,N,98900
Storyboards,(198,Silkscreen on paper,60,40,null,Lily Auchincloss Fund,Print,Prints & Illustrated Books,2005,N,98901
Storyboards,(198,Silkscreen on paper,60,40,null,Lily Auchincloss Fund,Print,Prints & Illustrated Books,2005,N,98902
Storyboards,(198,Silkscreen on paper,60,40,null,Lily Auchincloss Fund,Print,Prints & Illustrated Books,2005,N,98903
Cover from the portfolio God with Us (Gott mit uns),(191,Letterpress and line block,null,null,null,Abby Aldrich Rockefeller Fund,Print,Prints & Illustrated Books,1949,Y,99016
